{
  "feature_id": "009-orca-yolo",
  "current_stage": "review-code",
  "completed_milestones": [
    {
      "stage": "brainstorm",
      "status": "complete",
      "evidence_sources": [
        "<FIXTURE_ROOT>/specs/009-orca-yolo/brainstorm.md"
      ],
      "notes": []
    },
    {
      "stage": "specify",
      "status": "complete",
      "evidence_sources": [
        "<FIXTURE_ROOT>/specs/009-orca-yolo/spec.md"
      ],
      "notes": []
    },
    {
      "stage": "plan",
      "status": "complete",
      "evidence_sources": [
        "<FIXTURE_ROOT>/specs/009-orca-yolo/plan.md"
      ],
      "notes": []
    },
    {
      "stage": "tasks",
      "status": "complete",
      "evidence_sources": [
        "<FIXTURE_ROOT>/specs/009-orca-yolo/tasks.md"
      ],
      "notes": []
    },
    {
      "stage": "implement",
      "status": "complete",
      "evidence_sources": [
        "<FIXTURE_ROOT>/specs/009-orca-yolo/tasks.md"
      ],
      "notes": []
    }
  ],
  "incomplete_milestones": [
    {
      "stage": "review-spec",
      "status": "missing",
      "evidence_sources": [],
      "notes": []
    },
    {
      "stage": "review-code",
      "status": "phases_partial",
      "evidence_sources": [],
      "notes": [
        "Phases found: Phase B, Phase B (Core Runtime), Phase C (flow-state integration), Phase C+D, Phase D (matriarch supervised mode)"
      ]
    },
    {
      "stage": "review-pr",
      "status": "invalid",
      "evidence_sources": [],
      "notes": [
        "review-pr.md exists but has no recognized verdict"
      ]
    }
  ],
  "review_milestones": [
    {
      "review_type": "review-spec",
      "status": "missing",
      "evidence_sources": [],
      "notes": []
    },
    {
      "review_type": "review-code",
      "status": "phases_partial",
      "evidence_sources": [],
      "notes": [
        "Phases found: Phase B, Phase B (Core Runtime), Phase C (flow-state integration), Phase C+D, Phase D (matriarch supervised mode)"
      ]
    },
    {
      "review_type": "review-pr",
      "status": "invalid",
      "evidence_sources": [],
      "notes": [
        "review-pr.md exists but has no recognized verdict"
      ]
    }
  ],
  "ambiguities": [
    "review-pr.md exists but has no recognized verdict"
  ],
  "next_step": "Run /speckit.orca.review-spec for an adversarial cross-pass review of the spec.",
  "evidence_summary": [
    "Artifacts present: brainstorm.md, plan.md, review-code.md, review-pr.md, spec.md, tasks.md",
    "Task status: 65/67 completed, 0 assigned.",
    "Highest completed stage: review-code"
  ]
}
